TimeDelta,Length,Port,Protocol,Length,Info
0.019296,115,80,TCP,115,51749  >  80 [ACK] Seq=1 Ack=1 Win=229 Len=0 TSval=6572 TSecr=2064913944
0.000121,115,80,TCP,115,[TCP Dup ACK 27#1] 51749  >  80 [ACK] Seq=1 Ack=1 Win=229 Len=0 TSval=6572 TSecr=2064913944
0.000137,115,80,TCP,115,[TCP Dup ACK 27#2] 51749  >  80 [ACK] Seq=1 Ack=1 Win=229 Len=0 TSval=6572 TSecr=2064913944
0.000678,115,80,TCP,115,[TCP Dup ACK 27#3] 51749  >  80 [ACK] Seq=1 Ack=1 Win=229 Len=0 TSval=6572 TSecr=2064913944
0.000118,115,80,TCP,115,[TCP Dup ACK 27#4] 51749  >  80 [ACK] Seq=1 Ack=1 Win=229 Len=0 TSval=6572 TSecr=2064913944
0.033294,115,51749,TCP,115,80  >  51749 [ACK] Seq=1 Ack=2 Win=282 Len=0 TSval=2064958995 TSecr=2070
0.885541,115,80,TCP,115,52706  >  80 [ACK] Seq=1 Ack=1 Win=229 Len=0 TSval=6664 TSecr=4217167227
0.862652,209,443,TLSv1.2,209,Application Data
0.003573,154,443,TLSv1.2,154,Application Data
0.000192,154,443,TCP,154,"[TCP Retransmission] 36646  >  443 [PSH, ACK] Seq=95 Ack=1 Win=1339 Len=39 TSval=6773 TSecr=3423921163"
0.001363,154,443,TCP,154,"[TCP Retransmission] 36646  >  443 [PSH, ACK] Seq=95 Ack=1 Win=1339 Len=39 TSval=6773 TSecr=3423921163"
0.000552,154,443,TCP,154,"[TCP Retransmission] 36646  >  443 [PSH, ACK] Seq=95 Ack=1 Win=1339 Len=39 TSval=6773 TSecr=3423921163"
0.001416,154,443,TCP,154,"[TCP Retransmission] 36646  >  443 [PSH, ACK] Seq=95 Ack=1 Win=1339 Len=39 TSval=6773 TSecr=3423921163"
0.004283,211,443,TLSv1.2,211,Application Data
0.021806,115,36646,TCP,115,443  >  36646 [ACK] Seq=1 Ack=95 Win=1050 Len=0 TSval=3423965848 TSecr=6773
0.000127,115,36646,TCP,115,[TCP Dup ACK 43#1] 443  >  36646 [ACK] Seq=1 Ack=95 Win=1050 Len=0 TSval=3423965848 TSecr=6773
0.002151,115,36646,TCP,115,443  >  36646 [ACK] Seq=1 Ack=134 Win=1050 Len=0 TSval=3423965855 TSecr=6773
0.000166,115,36646,TCP,115,[TCP Dup ACK 46#1] 443  >  36646 [ACK] Seq=1 Ack=134 Win=1050 Len=0 TSval=3423965855 TSecr=6773
0.000214,154,36646,TLSv1.2,154,Application Data
0.008228,115,36646,TCP,115,443  >  36646 [ACK] Seq=40 Ack=230 Win=1050 Len=0 TSval=3423965864 TSecr=6774
0.000127,115,36646,TCP,115,[TCP Dup ACK 49#1] 443  >  36646 [ACK] Seq=40 Ack=230 Win=1050 Len=0 TSval=3423965864 TSecr=6774
0.000717,115,36646,TCP,115,[TCP Dup ACK 49#2] 443  >  36646 [ACK] Seq=40 Ack=230 Win=1050 Len=0 TSval=3423965864 TSecr=6774
0.000113,115,36646,TCP,115,[TCP Dup ACK 49#3] 443  >  36646 [ACK] Seq=40 Ack=230 Win=1050 Len=0 TSval=3423965864 TSecr=6774
0.000259,115,36646,TCP,115,[TCP Dup ACK 49#4] 443  >  36646 [ACK] Seq=40 Ack=230 Win=1050 Len=0 TSval=3423965864 TSecr=6774
0.002289,115,36646,TCP,115,[TCP Dup ACK 49#5] 443  >  36646 [ACK] Seq=40 Ack=230 Win=1050 Len=0 TSval=3423965864 TSecr=6774
0.019171,1483,443,TCP,1483,36646  >  443 [ACK] Seq=230 Ack=40 Win=1339 Len=1368 TSval=6780 TSecr=3423965856 [TCP segment of a reassembled PDU]
0.000352,1483,443,TCP,1483,36646  >  443 [ACK] Seq=1598 Ack=40 Win=1339 Len=1368 TSval=6780 TSecr=3423965856 [TCP segment of a reassembled PDU]
0.000219,262,443,TLSv1.2,262,Application Data
0.000263,1483,443,TCP,1483,36646  >  443 [ACK] Seq=3113 Ack=40 Win=1339 Len=1368 TSval=6780 TSecr=3423965856 [TCP segment of a reassembled PDU]
0.000235,1483,443,TCP,1483,36646  >  443 [ACK] Seq=4481 Ack=40 Win=1339 Len=1368 TSval=6780 TSecr=3423965856 [TCP segment of a reassembled PDU]
0.032509,115,36646,TCP,115,443  >  36646 [ACK] Seq=40 Ack=1598 Win=1050 Len=0 TSval=3423965920 TSecr=6780
0.000204,115,36646,TCP,115,443  >  36646 [ACK] Seq=40 Ack=2966 Win=1050 Len=0 TSval=3423965920 TSecr=6780
0.000146,115,36646,TCP,115,443  >  36646 [ACK] Seq=40 Ack=3113 Win=1050 Len=0 TSval=3423965920 TSecr=6780
0.000144,115,36646,TCP,115,443  >  36646 [ACK] Seq=40 Ack=4481 Win=1050 Len=0 TSval=3423965920 TSecr=6780
0.000283,115,36646,TCP,115,443  >  36646 [ACK] Seq=40 Ack=5849 Win=1050 Len=0 TSval=3423965921 TSecr=6780
0.000255,1483,443,TLSv1.2,1483,"Application Data, Application Data"
0.00028,1483,443,TCP,1483,36646  >  443 [ACK] Seq=7217 Ack=40 Win=1339 Len=1368 TSval=6783 TSecr=3423965920 [TCP segment of a reassembled PDU]
0.000416,1483,443,TLSv1.2,1483,Application Data
0.000294,1483,443,TLSv1.2,1483,Application Data
0.000267,1483,443,TCP,1483,36646  >  443 [ACK] Seq=11321 Ack=40 Win=1339 Len=1368 TSval=6783 TSecr=3423965920 [TCP segment of a reassembled PDU]
0.000454,1483,443,TLSv1.2,1483,Application Data
0.000345,1483,443,TLSv1.2,1483,Application Data
0.033502,115,36646,TCP,115,443  >  36646 [ACK] Seq=40 Ack=7217 Win=1050 Len=0 TSval=3423965955 TSecr=6783
0.000164,115,36646,TCP,115,443  >  36646 [ACK] Seq=40 Ack=8585 Win=1050 Len=0 TSval=3423965955 TSecr=6783
0.000144,115,36646,TCP,115,443  >  36646 [ACK] Seq=40 Ack=9953 Win=1050 Len=0 TSval=3423965955 TSecr=6783
0.000146,115,36646,TCP,115,443  >  36646 [ACK] Seq=40 Ack=11321 Win=1050 Len=0 TSval=3423965955 TSecr=6783
0.000219,115,36646,TCP,115,443  >  36646 [ACK] Seq=40 Ack=12689 Win=1050 Len=0 TSval=3423965956 TSecr=6783
0.000141,115,36646,TCP,115,443  >  36646 [ACK] Seq=40 Ack=14057 Win=1050 Len=0 TSval=3423965956 TSecr=6783
0.000157,115,36646,TCP,115,443  >  36646 [ACK] Seq=40 Ack=15425 Win=1050 Len=0 TSval=3423965956 TSecr=6783
0.000267,1483,443,TCP,1483,"36646  >  443 [PSH, ACK] Seq=15425 Ack=40 Win=1339 Len=1368 TSval=6787 TSecr=3423965955 [TCP segment of a reassembled PDU]"
0.001379,1483,443,TLSv1.2,1483,Application Data
0.000199,1483,443,TLSv1.2,1483,Application Data
0.000327,1483,443,TCP,1483,36646  >  443 [ACK] Seq=19529 Ack=40 Win=1339 Len=1368 TSval=6787 TSecr=3423965955 [TCP segment of a reassembled PDU]
0.000264,1483,443,TLSv1.2,1483,Application Data
0.000261,1483,443,TLSv1.2,1483,Application Data
0.00042,1483,443,TCP,1483,36646  >  443 [ACK] Seq=23633 Ack=40 Win=1339 Len=1368 TSval=6787 TSecr=3423965956 [TCP segment of a reassembled PDU]
0.000318,1483,443,TLSv1.2,1483,Application Data
0.00027,1483,443,TCP,1483,36646  >  443 [ACK] Seq=26369 Ack=40 Win=1339 Len=1368 TSval=6787 TSecr=3423965956 [TCP segment of a reassembled PDU]
0.000424,1483,443,TLSv1.2,1483,Application Data
0.000395,1483,443,TCP,1483,36646  >  443 [ACK] Seq=29105 Ack=40 Win=1339 Len=1368 TSval=6787 TSecr=3423965956 [TCP segment of a reassembled PDU]
0.030297,115,36646,TCP,115,443  >  36646 [ACK] Seq=40 Ack=18161 Win=1050 Len=0 TSval=3423965992 TSecr=6787
0.000196,115,36646,TCP,115,443  >  36646 [ACK] Seq=40 Ack=20897 Win=1050 Len=0 TSval=3423965993 TSecr=6787
0.000795,115,36646,TCP,115,443  >  36646 [ACK] Seq=40 Ack=23633 Win=1050 Len=0 TSval=3423965994 TSecr=6787
0.000501,115,36646,TCP,115,443  >  36646 [ACK] Seq=40 Ack=26369 Win=1050 Len=0 TSval=3423965994 TSecr=6787
0.000604,115,36646,TCP,115,[TCP Dup ACK 93#1] 443  >  36646 [ACK] Seq=40 Ack=26369 Win=1050 Len=0 TSval=3423965994 TSecr=6787
0.000151,115,36646,TCP,115,443  >  36646 [ACK] Seq=40 Ack=29105 Win=1050 Len=0 TSval=3423965995 TSecr=6787
0.000269,1483,443,TLSv1.2,1483,Application Data
0.000455,1483,443,TLSv1.2,1483,Application Data
0.000332,1483,443,TCP,1483,36646  >  443 [ACK] Seq=33209 Ack=40 Win=1339 Len=1368 TSval=6791 TSecr=3423965993 [TCP segment of a reassembled PDU]
0.000292,1483,443,TLSv1.2,1483,Application Data
0.000414,1483,443,TLSv1.2,1483,Application Data
0.000335,1483,443,TCP,1483,36646  >  443 [ACK] Seq=37313 Ack=40 Win=1339 Len=1368 TSval=6791 TSecr=3423965994 [TCP segment of a reassembled PDU]
0.00027,1483,443,TLSv1.2,1483,Application Data
0.000414,1483,443,TCP,1483,36646  >  443 [ACK] Seq=40049 Ack=40 Win=1339 Len=1368 TSval=6791 TSecr=3423965994 [TCP segment of a reassembled PDU]
0.000335,1483,443,TLSv1.2,1483,Application Data
0.000431,1483,443,TCP,1483,36646  >  443 [ACK] Seq=42785 Ack=40 Win=1339 Len=1368 TSval=6791 TSecr=3423965994 [TCP segment of a reassembled PDU]
0.000317,1483,443,TLSv1.2,1483,Application Data
0.000291,1483,443,TCP,1483,36646  >  443 [ACK] Seq=45521 Ack=40 Win=1339 Len=1368 TSval=6791 TSecr=3423965995 [TCP segment of a reassembled PDU]
0.000912,115,36646,TCP,115,443  >  36646 [ACK] Seq=40 Ack=30473 Win=1050 Len=0 TSval=3423966000 TSecr=6787
0.002272,1483,443,TLSv1.2,1483,Application Data
0.026712,115,36646,TCP,115,443  >  36646 [ACK] Seq=40 Ack=33209 Win=1050 Len=0 TSval=3423966029 TSecr=6791
0.000487,115,36646,TCP,115,443  >  36646 [ACK] Seq=40 Ack=35945 Win=1050 Len=0 TSval=3423966029 TSecr=6791
0.000719,1483,443,TCP,1483,[TCP Previous segment not captured] 36646  >  443 [ACK] Seq=49625 Ack=40 Win=1339 Len=1368 TSval=6794 TSecr=3423966029 [TCP segment of a reassembled PDU]
0.00035,1483,443,TCP,1483,36646  >  443 [ACK] Seq=50993 Ack=40 Win=1339 Len=1368 TSval=6794 TSecr=3423966029 [TCP segment of a reassembled PDU]
0.000227,1483,443,TLSv1.2,1483,Application Data
0.000118,115,36646,TCP,115,443  >  36646 [ACK] Seq=40 Ack=38681 Win=1050 Len=0 TSval=3423966030 TSecr=6791
0.000425,1483,443,TCP,1483,"[TCP Retransmission] 36646  >  443 [PSH, ACK] Seq=52361 Ack=40 Win=1339 Len=1368 TSval=6794 TSecr=3423966029"
0.00016,833,443,TLSv1.2,833,Application Data
0.000447,115,36646,TCP,115,443  >  36646 [ACK] Seq=40 Ack=42785 Win=1041 Len=0 TSval=3423966031 TSecr=6791
0.000194,115,36646,TCP,115,443  >  36646 [ACK] Seq=40 Ack=45521 Win=1050 Len=0 TSval=3423966032 TSecr=6791
0.002653,115,36646,TCP,115,443  >  36646 [ACK] Seq=40 Ack=48257 Win=1050 Len=0 TSval=3423966034 TSecr=6791
0.007762,115,36646,TCP,115,[TCP ACKed unseen segment] 443  >  36646 [ACK] Seq=40 Ack=49625 Win=1050 Len=0 TSval=3423966040 TSecr=6791
0.021413,115,36646,TCP,115,443  >  36646 [ACK] Seq=40 Ack=52361 Win=1050 Len=0 TSval=3423966063 TSecr=6794
0.000498,115,36646,TCP,115,443  >  36646 [ACK] Seq=40 Ack=54447 Win=1050 Len=0 TSval=3423966064 TSecr=6794
0.000927,1483,443,TCP,1483,36646  >  443 [ACK] Seq=54447 Ack=40 Win=1339 Len=1368 TSval=6798 TSecr=3423966063 [TCP segment of a reassembled PDU]
0.000354,1483,443,TCP,1483,36646  >  443 [ACK] Seq=55815 Ack=40 Win=1339 Len=1368 TSval=6798 TSecr=3423966063 [TCP segment of a reassembled PDU]
0.000224,262,443,TLSv1.2,262,Application Data
0.000071,262,443,TCP,262,"[TCP Retransmission] 36646  >  443 [PSH, ACK] Seq=57183 Ack=40 Win=1339 Len=147 TSval=6798 TSecr=3423966063"
0.00012,262,443,TCP,262,"[TCP Retransmission] 36646  >  443 [PSH, ACK] Seq=57183 Ack=40 Win=1339 Len=147 TSval=6798 TSecr=3423966063"
0.000146,652,443,TLSv1.2,652,Application Data
0.032781,115,36646,TCP,115,443  >  36646 [ACK] Seq=40 Ack=57183 Win=1050 Len=0 TSval=3423966099 TSecr=6798
0.000202,115,36646,TCP,115,443  >  36646 [ACK] Seq=40 Ack=57330 Win=1050 Len=0 TSval=3423966099 TSecr=6798
0.000284,115,36646,TCP,115,443  >  36646 [ACK] Seq=40 Ack=57867 Win=1050 Len=0 TSval=3423966099 TSecr=6798
0.102517,1483,443,TCP,1483,36646  >  443 [ACK] Seq=57867 Ack=40 Win=1339 Len=1368 TSval=6811 TSecr=3423966099 [TCP segment of a reassembled PDU]
0.000321,1483,443,TCP,1483,36646  >  443 [ACK] Seq=59235 Ack=40 Win=1339 Len=1368 TSval=6811 TSecr=3423966099 [TCP segment of a reassembled PDU]
0.032027,115,36646,TCP,115,443  >  36646 [ACK] Seq=40 Ack=60603 Win=1050 Len=0 TSval=3423966234 TSecr=6811
0.0002,115,36646,TCP,115,[TCP ACKed unseen segment] 443  >  36646 [ACK] Seq=40 Ack=60750 Win=1050 Len=0 TSval=3423966234 TSecr=6811
0.000147,115,36646,TCP,115,443  >  36646 [ACK] Seq=40 Ack=62208 Win=1048 Len=0 TSval=3423966234 TSecr=6811
0.085338,1483,443,TCP,1483,[TCP Previous segment not captured] 36646  >  443 [ACK] Seq=62208 Ack=40 Win=1339 Len=1368 TSval=6823 TSecr=3423966234 [TCP segment of a reassembled PDU]
0.000427,1483,443,TCP,1483,36646  >  443 [ACK] Seq=63576 Ack=40 Win=1339 Len=1368 TSval=6823 TSecr=3423966234 [TCP segment of a reassembled PDU]
0.000227,262,443,TLSv1.2,262,Application Data
0.000224,495,443,TLSv1.2,495,Application Data
0.033219,115,36646,TCP,115,[TCP ACKed unseen segment] 443  >  36646 [ACK] Seq=40 Ack=65471 Win=1041 Len=0 TSval=3423966354 TSecr=6823
0.09862,1483,443,TCP,1483,36646  >  443 [ACK] Seq=65471 Ack=40 Win=1339 Len=1368 TSval=6836 TSecr=3423966354 [TCP segment of a reassembled PDU]
0.000181,1483,443,TCP,1483,[TCP Retransmission] 36646  >  443 [ACK] Seq=65471 Ack=40 Win=1339 Len=1368 TSval=6836 TSecr=3423966354
0.00019,1483,443,TCP,1483,36646  >  443 [ACK] Seq=66839 Ack=40 Win=1339 Len=1368 TSval=6837 TSecr=3423966354 [TCP segment of a reassembled PDU]
0.000272,262,443,TLSv1.2,262,Application Data
0.000269,1483,443,TCP,1483,36646  >  443 [ACK] Seq=68354 Ack=40 Win=1339 Len=1368 TSval=6837 TSecr=3423966354 [TCP segment of a reassembled PDU]
0.000225,205,443,TLSv1.2,205,Application Data
0.027606,182,36646,TLSv1.2,182,Application Data
0.000195,153,36646,TLSv1.2,153,Application Data
0.00015,169,36646,TLSv1.2,169,Application Data
0.000858,115,443,TCP,115,36646  >  443 [ACK] Seq=69812 Ack=199 Win=1339 Len=0 TSval=6843 TSecr=3423966515
0.019402,163,443,TLSv1.2,163,Application Data
0.037183,115,36646,TCP,115,443  >  36646 [ACK] Seq=199 Ack=69860 Win=1050 Len=0 TSval=3423966573 TSecr=6845
0.004523,1483,443,TCP,1483,36646  >  443 [ACK] Seq=69860 Ack=199 Win=1339 Len=1368 TSval=6849 TSecr=3423966573 [TCP segment of a reassembled PDU]
0.000257,1483,443,TCP,1483,36646  >  443 [ACK] Seq=71228 Ack=199 Win=1339 Len=1368 TSval=6849 TSecr=3423966573 [TCP segment of a reassembled PDU]
0.000266,262,443,TLSv1.2,262,Application Data
0.000272,579,443,TLSv1.2,579,Application Data
0.02887,175,36646,TLSv1.2,175,Application Data
0.00387,115,36646,TCP,115,443  >  36646 [ACK] Seq=259 Ack=72596 Win=1050 Len=0 TSval=3423966611 TSecr=6849
0.000294,115,36646,TCP,115,443  >  36646 [ACK] Seq=259 Ack=73207 Win=1050 Len=0 TSval=3423966611 TSecr=6849
0.034838,115,443,TCP,115,36646  >  443 [ACK] Seq=73207 Ack=259 Win=1339 Len=0 TSval=6856 TSecr=3423966606
0.063917,1483,443,TCP,1483,36646  >  443 [ACK] Seq=73207 Ack=259 Win=1339 Len=1368 TSval=6862 TSecr=3423966606 [TCP segment of a reassembled PDU]
0.000275,1483,443,TCP,1483,36646  >  443 [ACK] Seq=74575 Ack=259 Win=1339 Len=1368 TSval=6862 TSecr=3423966606 [TCP segment of a reassembled PDU]
0.000286,262,443,TLSv1.2,262,Application Data
0.000276,1483,443,TCP,1483,36646  >  443 [ACK] Seq=76090 Ack=259 Win=1339 Len=1368 TSval=6862 TSecr=3423966606 [TCP segment of a reassembled PDU]
0.000226,205,443,TLSv1.2,205,Application Data
0.035104,115,36646,TCP,115,443  >  36646 [ACK] Seq=259 Ack=75943 Win=1050 Len=0 TSval=3423966744 TSecr=6862
0.001378,115,36646,TCP,115,[TCP Dup ACK 169#1] 443  >  36646 [ACK] Seq=259 Ack=75943 Win=1050 Len=0 TSval=3423966744 TSecr=6862
0.00019,115,36646,TCP,115,443  >  36646 [ACK] Seq=259 Ack=77458 Win=1050 Len=0 TSval=3423966744 TSecr=6862
0.001104,115,36646,TCP,115,443  >  36646 [ACK] Seq=259 Ack=77548 Win=1050 Len=0 TSval=3423966749 TSecr=6862
0.007651,461,36646,TLSv1.2,461,Application Data
0.000464,115,443,TCP,115,36646  >  443 [ACK] Seq=77548 Ack=605 Win=1339 Len=0 TSval=6867 TSecr=3423966756
0.079947,1483,443,TCP,1483,36646  >  443 [ACK] Seq=77548 Ack=605 Win=1339 Len=1368 TSval=6874 TSecr=3423966756 [TCP segment of a reassembled PDU]
0.000205,1483,443,TCP,1483,36646  >  443 [ACK] Seq=78916 Ack=605 Win=1339 Len=1368 TSval=6874 TSecr=3423966756 [TCP segment of a reassembled PDU]
0.005675,1483,443,TCP,1483,[TCP Retransmission] 36646  >  443 [ACK] Seq=78916 Ack=605 Win=1339 Len=1368 TSval=6874 TSecr=3423966756
0.000388,1483,443,TCP,1483,[TCP Retransmission] 36646  >  443 [ACK] Seq=78916 Ack=605 Win=1339 Len=1368 TSval=6874 TSecr=3423966756
0.00062,1483,443,TCP,1483,[TCP Retransmission] 36646  >  443 [ACK] Seq=78916 Ack=605 Win=1339 Len=1368 TSval=6874 TSecr=3423966756
0.001536,1483,443,TCP,1483,[TCP Retransmission] 36646  >  443 [ACK] Seq=78916 Ack=605 Win=1339 Len=1368 TSval=6874 TSecr=3423966756
0.000194,262,443,TLSv1.2,262,Application Data
0.000238,708,443,TLSv1.2,708,Application Data
0.010546,184,36646,TLSv1.2,184,Application Data
0.000819,115,443,TCP,115,36646  >  443 [ACK] Seq=81024 Ack=674 Win=1339 Len=0 TSval=6878 TSecr=3423966863
0.011095,115,36646,TCP,115,443  >  36646 [ACK] Seq=674 Ack=78916 Win=1050 Len=0 TSval=3423966875 TSecr=6874
0.003623,115,36646,TCP,115,443  >  36646 [ACK] Seq=674 Ack=80431 Win=1050 Len=0 TSval=3423966879 TSecr=6874
0.000156,115,36646,TCP,115,443  >  36646 [ACK] Seq=674 Ack=81024 Win=1050 Len=0 TSval=3423966879 TSecr=6874
0.08749,115,443,TCP,115,[TCP ACKed unseen segment] 36646  >  443 [ACK] Seq=81024 Ack=807 Win=1339 Len=0 TSval=6887 TSecr=3423966956
0.000273,115,443,TCP,115,36646  >  443 [ACK] Seq=81024 Ack=853 Win=1339 Len=0 TSval=6888 TSecr=3423966956
0.000282,1483,443,TCP,1483,36646  >  443 [ACK] Seq=81024 Ack=853 Win=1339 Len=1368 TSval=6888 TSecr=3423966956 [TCP segment of a reassembled PDU]
0.000533,1483,443,TCP,1483,36646  >  443 [ACK] Seq=82392 Ack=853 Win=1339 Len=1368 TSval=6888 TSecr=3423966956 [TCP segment of a reassembled PDU]
0.00027,262,443,TLSv1.2,262,Application Data
0.00021,1483,443,TCP,1483,36646  >  443 [ACK] Seq=83907 Ack=853 Win=1339 Len=1368 TSval=6888 TSecr=3423966956 [TCP segment of a reassembled PDU]
0.000226,205,443,TLSv1.2,205,Application Data
0.004632,313,36646,TLSv1.2,313,"[TCP Previous segment not captured] , Application Data"
0.000207,157,36646,TLSv1.2,157,Application Data
0.000782,115,443,TCP,115,[TCP ACKed unseen segment] 36646  >  443 [ACK] Seq=85365 Ack=1093 Win=1339 Len=0 TSval=6889 TSecr=3423966972
0.003008,193,36646,TLSv1.2,193,Application Data
0.000194,157,36646,TLSv1.2,157,Application Data
0.000891,115,443,TCP,115,36646  >  443 [ACK] Seq=85365 Ack=1213 Win=1339 Len=0 TSval=6889 TSecr=3423966976
0.002978,198,36646,TLSv1.2,198,Application Data
0.000195,157,36646,TLSv1.2,157,Application Data
0.000505,115,443,TCP,115,36646  >  443 [ACK] Seq=85365 Ack=1338 Win=1339 Len=0 TSval=6889 TSecr=3423966980
0.000085,115,443,TCP,115,[TCP Dup ACK 204#1] 36646  >  443 [ACK] Seq=85365 Ack=1338 Win=1339 Len=0 TSval=6889 TSecr=3423966980
0.002091,191,36646,TLSv1.2,191,Application Data
0.000197,157,36646,TLSv1.2,157,Application Data
0.001613,115,443,TCP,115,36646  >  443 [ACK] Seq=85365 Ack=1456 Win=1339 Len=0 TSval=6890 TSecr=3423966983
0.002003,198,36646,TLSv1.2,198,Application Data
0.000211,157,36646,TLSv1.2,157,Application Data
0.001824,115,443,TCP,115,36646  >  443 [ACK] Seq=85365 Ack=1581 Win=1339 Len=0 TSval=6890 TSecr=3423966987
0.000084,115,443,TCP,115,[TCP Dup ACK 211#1] 36646  >  443 [ACK] Seq=85365 Ack=1581 Win=1339 Len=0 TSval=6890 TSecr=3423966987
0.000359,115,443,TCP,115,[TCP Dup ACK 211#2] 36646  >  443 [ACK] Seq=85365 Ack=1581 Win=1339 Len=0 TSval=6890 TSecr=3423966987
0.000416,115,443,TCP,115,[TCP Dup ACK 211#3] 36646  >  443 [ACK] Seq=85365 Ack=1581 Win=1339 Len=0 TSval=6890 TSecr=3423966987
0.001253,115,443,TCP,115,[TCP Dup ACK 211#4] 36646  >  443 [ACK] Seq=85365 Ack=1581 Win=1339 Len=0 TSval=6890 TSecr=3423966987
0.000081,192,36646,TLSv1.2,192,Application Data
0.002057,157,36646,TLSv1.2,157,Application Data
0.000142,115,443,TCP,115,[TCP Dup ACK 211#5] 36646  >  443 [ACK] Seq=85365 Ack=1581 Win=1339 Len=0 TSval=6890 TSecr=3423966987
0.000392,157,36646,TCP,157,"[TCP Retransmission] 443  >  36646 [PSH, ACK] Seq=1658 Ack=81024 Win=1050 Len=42 TSval=3423966992 TSecr=6878"
0.001244,157,36646,TCP,157,"[TCP Retransmission] 443  >  36646 [PSH, ACK] Seq=1658 Ack=81024 Win=1050 Len=42 TSval=3423966992 TSecr=6878"
0.000155,192,36646,TLSv1.2,192,Application Data
0.000149,157,36646,TLSv1.2,157,Application Data
0.005411,197,36646,TLSv1.2,197,Application Data
0.000222,115,36646,TCP,115,[TCP Previous segment not captured] 443  >  36646 [ACK] Seq=1943 Ack=83760 Win=1050 Len=0 TSval=3423967000 TSecr=6888
0.001464,115,36646,TCP,115,443  >  36646 [ACK] Seq=1943 Ack=83907 Win=1050 Len=0 TSval=3423967000 TSecr=6888
0.000149,115,36646,TCP,115,443  >  36646 [ACK] Seq=1943 Ack=85365 Win=1048 Len=0 TSval=3423967001 TSecr=6888
0.000147,150,36646,TLSv1.2,150,Application Data
0.000279,115,443,TCP,115,36646  >  443 [ACK] Seq=85365 Ack=1819 Win=1339 Len=0 TSval=6891 TSecr=3423966992
0.00027,115,443,TCP,115,[TCP ACKed unseen segment] 36646  >  443 [ACK] Seq=85365 Ack=1943 Win=1339 Len=0 TSval=6891 TSecr=3423966999
0.000227,115,443,TCP,115,[TCP ACKed unseen segment] 36646  >  443 [ACK] Seq=85365 Ack=2057 Win=1339 Len=0 TSval=6892 TSecr=3423967001
0.003925,197,36646,TLSv1.2,197,"[TCP Previous segment not captured] , Application Data"
0.000193,157,36646,TLSv1.2,157,Application Data
0.000719,115,443,TCP,115,[TCP ACKed unseen segment] 36646  >  443 [ACK] Seq=85365 Ack=2223 Win=1339 Len=0 TSval=6892 TSecr=3423967002
0.00117,192,36646,TLSv1.2,192,Application Data
0.000241,157,36646,TLSv1.2,157,Application Data
0.001045,115,443,TCP,115,36646  >  443 [ACK] Seq=85365 Ack=2342 Win=1339 Len=0 TSval=6892 TSecr=3423967010
0.00276,193,36646,TLSv1.2,193,Application Data
0.000201,157,36646,TLSv1.2,157,Application Data
0.000922,115,443,TCP,115,36646  >  443 [ACK] Seq=85365 Ack=2462 Win=1339 Len=0 TSval=6893 TSecr=3423967014
0.002812,208,36646,TLSv1.2,208,Application Data
0.000202,157,36646,TLSv1.2,157,Application Data
0.001122,115,443,TCP,115,36646  >  443 [ACK] Seq=85365 Ack=2597 Win=1339 Len=0 TSval=6893 TSecr=3423967017
0.071181,1483,443,TCP,1483,36646  >  443 [ACK] Seq=85365 Ack=2597 Win=1339 Len=1368 TSval=6900 TSecr=3423967017 [TCP segment of a reassembled PDU]
0.00028,1483,443,TCP,1483,36646  >  443 [ACK] Seq=86733 Ack=2597 Win=1339 Len=1368 TSval=6900 TSecr=3423967017 [TCP segment of a reassembled PDU]
0.000293,262,443,TLSv1.2,262,Application Data
0.000231,693,443,TLSv1.2,693,Application Data
0.032771,115,36646,TCP,115,443  >  36646 [ACK] Seq=2597 Ack=88101 Win=1050 Len=0 TSval=3423967124 TSecr=6900
0.000201,115,36646,TCP,115,443  >  36646 [ACK] Seq=2597 Ack=88826 Win=1050 Len=0 TSval=3423967124 TSecr=6900
0.052308,192,36646,TLSv1.2,192,Application Data
0.000197,157,36646,TLSv1.2,157,Application Data
0.00085,115,443,TCP,115,36646  >  443 [ACK] Seq=88826 Ack=2716 Win=1339 Len=0 TSval=6909 TSecr=3423967176
0.000126,115,443,TCP,115,[TCP Dup ACK 251#1] 36646  >  443 [ACK] Seq=88826 Ack=2716 Win=1339 Len=0 TSval=6909 TSecr=3423967176
0.000139,115,443,TCP,115,[TCP Dup ACK 251#2] 36646  >  443 [ACK] Seq=88826 Ack=2716 Win=1339 Len=0 TSval=6909 TSecr=3423967176
0.000557,115,443,TCP,115,[TCP Dup ACK 251#3] 36646  >  443 [ACK] Seq=88826 Ack=2716 Win=1339 Len=0 TSval=6909 TSecr=3423967176
0.000857,115,443,TCP,115,[TCP Dup ACK 251#4] 36646  >  443 [ACK] Seq=88826 Ack=2716 Win=1339 Len=0 TSval=6909 TSecr=3423967176
0.00117,115,443,TCP,115,[TCP Dup ACK 251#5] 36646  >  443 [ACK] Seq=88826 Ack=2716 Win=1339 Len=0 TSval=6909 TSecr=3423967176
0.00196,115,443,TCP,115,[TCP Dup ACK 251#6] 36646  >  443 [ACK] Seq=88826 Ack=2716 Win=1339 Len=0 TSval=6909 TSecr=3423967176
0.003409,194,36646,TLSv1.2,194,Application Data
0.0002,157,36646,TLSv1.2,157,Application Data
0.000148,198,36646,TLSv1.2,198,Application Data
0.000147,157,36646,TLSv1.2,157,Application Data
0.0041,115,443,TCP,115,[TCP Dup ACK 251#7] 36646  >  443 [ACK] Seq=88826 Ack=2716 Win=1339 Len=0 TSval=6909 TSecr=3423967176
0.001916,190,36646,TLSv1.2,190,Application Data
0.000204,157,36646,TLSv1.2,157,Application Data
0.000278,191,36646,TLSv1.2,191,Application Data
0.000195,157,36646,TLSv1.2,157,Application Data
0.007528,115,443,TCP,115,[TCP Dup ACK 251#8] 36646  >  443 [ACK] Seq=88826 Ack=2716 Win=1339 Len=0 TSval=6909 TSecr=3423967176
0.000279,115,443,TCP,115,36646  >  443 [ACK] Seq=88826 Ack=2837 Win=1339 Len=0 TSval=6910 TSecr=3423967180
0.000274,115,443,TCP,115,36646  >  443 [ACK] Seq=88826 Ack=2962 Win=1339 Len=0 TSval=6910 TSecr=3423967184
0.000224,115,443,TCP,115,36646  >  443 [ACK] Seq=88826 Ack=3197 Win=1339 Len=0 TSval=6911 TSecr=3423967189
0.022711,1483,443,TCP,1483,36646  >  443 [ACK] Seq=88826 Ack=3197 Win=1339 Len=1368 TSval=6914 TSecr=3423967189 [TCP segment of a reassembled PDU]
0.000129,1483,443,TCP,1483,[TCP Retransmission] 36646  >  443 [ACK] Seq=88826 Ack=3197 Win=1339 Len=1368 TSval=6914 TSecr=3423967189
0.000211,1483,443,TCP,1483,36646  >  443 [ACK] Seq=90194 Ack=3197 Win=1339 Len=1368 TSval=6914 TSecr=3423967189 [TCP segment of a reassembled PDU]
0.000321,262,443,TLSv1.2,262,Application Data
0.000273,1483,443,TCP,1483,36646  >  443 [ACK] Seq=91709 Ack=3197 Win=1339 Len=1368 TSval=6914 TSecr=3423967189 [TCP segment of a reassembled PDU]
0.000268,1483,443,TCP,1483,36646  >  443 [ACK] Seq=93077 Ack=3197 Win=1339 Len=1368 TSval=6914 TSecr=3423967189 [TCP segment of a reassembled PDU]
0.00026,262,443,TLSv1.2,262,Application Data
0.000263,1483,443,TCP,1483,36646  >  443 [ACK] Seq=94592 Ack=3197 Win=1339 Len=1368 TSval=6914 TSecr=3423967189 [TCP segment of a reassembled PDU]
0.000444,1483,443,TCP,1483,36646  >  443 [ACK] Seq=95960 Ack=3197 Win=1339 Len=1368 TSval=6914 TSecr=3423967189 [TCP segment of a reassembled PDU]
0.000241,262,443,TLSv1.2,262,Application Data
0.000282,148,443,TLSv1.2,148,Application Data
0.031307,115,36646,TCP,115,443  >  36646 [ACK] Seq=3197 Ack=91709 Win=1043 Len=0 TSval=3423967258 TSecr=6914
0.000592,115,36646,TCP,115,[TCP Dup ACK 282#1] 443  >  36646 [ACK] Seq=3197 Ack=91709 Win=1043 Len=0 TSval=3423967258 TSecr=6914
0.000192,115,36646,TCP,115,443  >  36646 [ACK] Seq=3197 Ack=94445 Win=1050 Len=0 TSval=3423967258 TSecr=6914
0.000163,115,36646,TCP,115,443  >  36646 [ACK] Seq=3197 Ack=95960 Win=1050 Len=0 TSval=3423967259 TSecr=6914
0.000285,115,36646,TCP,115,443  >  36646 [ACK] Seq=3197 Ack=97475 Win=1050 Len=0 TSval=3423967259 TSecr=6914
0.004788,115,36646,TCP,115,443  >  36646 [ACK] Seq=3197 Ack=97508 Win=1050 Len=0 TSval=3423967264 TSecr=6914
0.081675,829,443,TLSv1.2,829,Application Data
0.034081,115,36646,TCP,115,443  >  36646 [ACK] Seq=3197 Ack=98222 Win=1050 Len=0 TSval=3423967379 TSecr=6925
0.052081,190,36646,TLSv1.2,190,Application Data
0.000198,157,36646,TLSv1.2,157,Application Data
0.001229,115,443,TCP,115,36646  >  443 [ACK] Seq=98222 Ack=3314 Win=1339 Len=0 TSval=6935 TSecr=3423967431
0.000127,115,443,TCP,115,[TCP Dup ACK 292#1] 36646  >  443 [ACK] Seq=98222 Ack=3314 Win=1339 Len=0 TSval=6935 TSecr=3423967431
0.000139,115,443,TCP,115,[TCP Dup ACK 292#2] 36646  >  443 [ACK] Seq=98222 Ack=3314 Win=1339 Len=0 TSval=6935 TSecr=3423967431
0.001311,115,443,TCP,115,[TCP Dup ACK 292#3] 36646  >  443 [ACK] Seq=98222 Ack=3314 Win=1339 Len=0 TSval=6935 TSecr=3423967431
0.001013,194,36646,TLSv1.2,194,Application Data
0.000202,157,36646,TLSv1.2,157,Application Data
0.000737,115,443,TCP,115,36646  >  443 [ACK] Seq=98222 Ack=3435 Win=1339 Len=0 TSval=6935 TSecr=3423967435
0.003868,189,36646,TLSv1.2,189,Application Data
0.000193,157,36646,TLSv1.2,157,Application Data
0.00133,115,443,TCP,115,36646  >  443 [ACK] Seq=98222 Ack=3551 Win=1339 Len=0 TSval=6935 TSecr=3423967441
0.001656,190,36646,TLSv1.2,190,Application Data
0.000195,157,36646,TLSv1.2,157,Application Data
0.000281,115,443,TCP,115,36646  >  443 [ACK] Seq=98222 Ack=3668 Win=1339 Len=0 TSval=6936 TSecr=3423967444
0.035666,1483,443,TCP,1483,36646  >  443 [ACK] Seq=98222 Ack=3668 Win=1339 Len=1368 TSval=6939 TSecr=3423967444 [TCP segment of a reassembled PDU]
0.000355,1483,443,TCP,1483,36646  >  443 [ACK] Seq=99590 Ack=3668 Win=1339 Len=1368 TSval=6939 TSecr=3423967444 [TCP segment of a reassembled PDU]
0.000192,262,443,TLSv1.2,262,Application Data
0.000472,1483,443,TCP,1483,36646  >  443 [ACK] Seq=101105 Ack=3668 Win=1339 Len=1368 TSval=6939 TSecr=3423967444 [TCP segment of a reassembled PDU]
0.000301,1483,443,TCP,1483,36646  >  443 [ACK] Seq=102473 Ack=3668 Win=1339 Len=1368 TSval=6939 TSecr=3423967444 [TCP segment of a reassembled PDU]
0.000224,262,443,TLSv1.2,262,Application Data
0.000269,1483,443,TCP,1483,36646  >  443 [ACK] Seq=103988 Ack=3668 Win=1339 Len=1368 TSval=6939 TSecr=3423967444 [TCP segment of a reassembled PDU]
0.000292,1483,443,TCP,1483,36646  >  443 [ACK] Seq=105356 Ack=3668 Win=1339 Len=1368 TSval=6939 TSecr=3423967444 [TCP segment of a reassembled PDU]
0.000277,262,443,TLSv1.2,262,Application Data
0.000227,148,443,TLSv1.2,148,Application Data
0.031953,115,36646,TCP,115,443  >  36646 [ACK] Seq=3668 Ack=100958 Win=1045 Len=0 TSval=3423967513 TSecr=6939
0.000193,115,36646,TCP,115,443  >  36646 [ACK] Seq=3668 Ack=101105 Win=1050 Len=0 TSval=3423967514 TSecr=6939
0.000153,115,36646,TCP,115,443  >  36646 [ACK] Seq=3668 Ack=103841 Win=1050 Len=0 TSval=3423967514 TSecr=6939
0.000234,115,36646,TCP,115,443  >  36646 [ACK] Seq=3668 Ack=103988 Win=1050 Len=0 TSval=3423967514 TSecr=6939
0.002248,115,36646,TCP,115,443  >  36646 [ACK] Seq=3668 Ack=106724 Win=1050 Len=0 TSval=3423967515 TSecr=6939
0.000202,115,36646,TCP,115,443  >  36646 [ACK] Seq=3668 Ack=106871 Win=1050 Len=0 TSval=3423967515 TSecr=6939
0.000151,115,36646,TCP,115,443  >  36646 [ACK] Seq=3668 Ack=106904 Win=1050 Len=0 TSval=3423967515 TSecr=6939
0.000148,169,36646,TLSv1.2,169,Application Data
0.034979,115,443,TCP,115,36646  >  443 [ACK] Seq=106904 Ack=3722 Win=1339 Len=0 TSval=6947 TSecr=3423967515
0.00226,115,443,TCP,115,[TCP Dup ACK 323#1] 36646  >  443 [ACK] Seq=106904 Ack=3722 Win=1339 Len=0 TSval=6947 TSecr=3423967515
0.085736,115,36646,TCP,115,443  >  36646 [ACK] Seq=3722 Ack=109021 Win=1047 Len=0 TSval=3423967642 TSecr=6951
0.052548,115,443,TCP,115,[TCP ACKed unseen segment] [TCP Previous segment not captured] 36646  >  443 [ACK] Seq=109021 Ack=3845 Win=1339 Len=0 TSval=6961 TSecr=3423967693
0.000267,115,443,TCP,115,36646  >  443 [ACK] Seq=109021 Ack=3922 Win=1339 Len=0 TSval=6961 TSecr=3423967696
0.000378,115,443,TCP,115,36646  >  443 [ACK] Seq=109021 Ack=3964 Win=1339 Len=0 TSval=6961 TSecr=3423967696
0.035525,1483,443,TCP,1483,36646  >  443 [ACK] Seq=109021 Ack=3964 Win=1339 Len=1368 TSval=6965 TSecr=3423967696 [TCP segment of a reassembled PDU]
0.000364,1483,443,TCP,1483,36646  >  443 [ACK] Seq=110389 Ack=3964 Win=1339 Len=1368 TSval=6965 TSecr=3423967696 [TCP segment of a reassembled PDU]
0.000221,262,443,TLSv1.2,262,Application Data
0.000263,1483,443,TCP,1483,36646  >  443 [ACK] Seq=111904 Ack=3964 Win=1339 Len=1368 TSval=6965 TSecr=3423967696 [TCP segment of a reassembled PDU]
0.000221,1483,443,TCP,1483,36646  >  443 [ACK] Seq=113272 Ack=3964 Win=1339 Len=1368 TSval=6965 TSecr=3423967696 [TCP segment of a reassembled PDU]
0.000275,262,443,TLSv1.2,262,Application Data
0.000271,1483,443,TCP,1483,36646  >  443 [ACK] Seq=114787 Ack=3964 Win=1339 Len=1368 TSval=6965 TSecr=3423967696 [TCP segment of a reassembled PDU]
0.000283,1483,443,TCP,1483,36646  >  443 [ACK] Seq=116155 Ack=3964 Win=1339 Len=1368 TSval=6965 TSecr=3423967696 [TCP segment of a reassembled PDU]
0.000231,262,443,TLSv1.2,262,Application Data
0.000271,148,443,TLSv1.2,148,Application Data
0.031289,115,36646,TCP,115,[TCP ACKed unseen segment] [TCP Previous segment not captured] 443  >  36646 [ACK] Seq=3964 Ack=111757 Win=1050 Len=0 TSval=3423967768 TSecr=6965
0.00034,115,36646,TCP,115,443  >  36646 [ACK] Seq=3964 Ack=113272 Win=1050 Len=0 TSval=3423967768 TSecr=6965
0.000148,115,36646,TCP,115,443  >  36646 [ACK] Seq=3964 Ack=114787 Win=1050 Len=0 TSval=3423967768 TSecr=6965
0.000778,115,36646,TCP,115,443  >  36646 [ACK] Seq=3964 Ack=117523 Win=1050 Len=0 TSval=3423967769 TSecr=6965
0.000343,115,36646,TCP,115,443  >  36646 [ACK] Seq=3964 Ack=117703 Win=1050 Len=0 TSval=3423967769 TSecr=6965
0.001801,996,443,TLSv1.2,996,"[TCP ACKed unseen segment] , Application Data"
0.048105,115,36646,TCP,115,443  >  36646 [ACK] Seq=3964 Ack=118584 Win=1050 Len=0 TSval=3423967893 TSecr=6977
0.059617,221,36646,TLSv1.2,221,Application Data
0.000192,168,36646,TLSv1.2,168,Application Data
0.002566,115,443,TCP,115,36646  >  443 [ACK] Seq=118584 Ack=4070 Win=1339 Len=0 TSval=6988 TSecr=3423967963
0.000193,115,443,TCP,115,36646  >  443 [ACK] Seq=118584 Ack=4123 Win=1339 Len=0 TSval=6988 TSecr=3423967963
0.025462,1483,443,TCP,1483,36646  >  443 [ACK] Seq=118584 Ack=4123 Win=1339 Len=1368 TSval=6990 TSecr=3423967963 [TCP segment of a reassembled PDU]
0.000257,1483,443,TCP,1483,[TCP Retransmission] 36646  >  443 [ACK] Seq=118584 Ack=4123 Win=1339 Len=1368 TSval=6990 TSecr=3423967963
0.000469,1483,443,TCP,1483,[TCP Retransmission] 36646  >  443 [ACK] Seq=118584 Ack=4123 Win=1339 Len=1368 TSval=6990 TSecr=3423967963
0.000746,1483,443,TCP,1483,[TCP Retransmission] 36646  >  443 [ACK] Seq=118584 Ack=4123 Win=1339 Len=1368 TSval=6990 TSecr=3423967963
0.000274,1483,443,TCP,1483,36646  >  443 [ACK] Seq=119952 Ack=4123 Win=1339 Len=1368 TSval=6990 TSecr=3423967963 [TCP segment of a reassembled PDU]
0.000267,262,443,TLSv1.2,262,Application Data
0.000284,1483,443,TCP,1483,36646  >  443 [ACK] Seq=121467 Ack=4123 Win=1339 Len=1368 TSval=6990 TSecr=3423967963 [TCP segment of a reassembled PDU]
0.000274,205,443,TLSv1.2,205,Application Data
0.00027,1483,443,TCP,1483,36646  >  443 [ACK] Seq=122925 Ack=4123 Win=1339 Len=1368 TSval=6990 TSecr=3423967963 [TCP segment of a reassembled PDU]
0.000279,1483,443,TCP,1483,36646  >  443 [ACK] Seq=124293 Ack=4123 Win=1339 Len=1368 TSval=6990 TSecr=3423967963 [TCP segment of a reassembled PDU]
0.000224,262,443,TLSv1.2,262,Application Data
0.000275,1483,443,TCP,1483,36646  >  443 [ACK] Seq=125808 Ack=4123 Win=1339 Len=1368 TSval=6990 TSecr=3423967963 [TCP segment of a reassembled PDU]
0.000278,205,443,TLSv1.2,205,Application Data
0.032679,115,36646,TCP,115,443  >  36646 [ACK] Seq=4123 Ack=121467 Win=1043 Len=0 TSval=3423968027 TSecr=6990
0.000193,115,36646,TCP,115,443  >  36646 [ACK] Seq=4123 Ack=122925 Win=1048 Len=0 TSval=3423968027 TSecr=6990
0.000147,115,36646,TCP,115,443  >  36646 [ACK] Seq=4123 Ack=125661 Win=1050 Len=0 TSval=3423968028 TSecr=6990
0.000146,115,36646,TCP,115,443  >  36646 [ACK] Seq=4123 Ack=125808 Win=1050 Len=0 TSval=3423968028 TSecr=6990
0.000218,115,36646,TCP,115,443  >  36646 [ACK] Seq=4123 Ack=127266 Win=1048 Len=0 TSval=3423968028 TSecr=6990
0.085893,1256,443,TLSv1.2,1256,Application Data
0.0332,115,36646,TCP,115,443  >  36646 [ACK] Seq=4123 Ack=128407 Win=1050 Len=0 TSval=3423968148 TSecr=7003
0.048385,203,36646,TLSv1.2,203,Application Data
0.002065,115,443,TCP,115,[TCP ACKed unseen segment] 36646  >  443 [ACK] Seq=128407 Ack=4263 Win=1339 Len=0 TSval=7011 TSecr=3423968196
0.006926,115,443,TCP,115,36646  >  443 [ACK] Seq=128407 Ack=4371 Win=1339 Len=0 TSval=7012 TSecr=3423968204
0.00402,199,36646,TLSv1.2,199,"[TCP Previous segment not captured] , Application Data"
0.000166,199,36646,TCP,199,"[TCP Retransmission] 443  >  36646 [PSH, ACK] Seq=4371 Ack=128407 Win=1050 Len=84 TSval=3423968209 TSecr=7003"
0.000149,167,36646,TLSv1.2,167,Application Data
0.001306,115,443,TCP,115,[TCP ACKed unseen segment] 36646  >  443 [ACK] Seq=128407 Ack=4507 Win=1339 Len=0 TSval=7012 TSecr=3423968209
0.005014,189,36646,TLSv1.2,189,Application Data
0.000202,159,36646,TLSv1.2,159,Application Data
0.001608,115,443,TCP,115,36646  >  443 [ACK] Seq=128407 Ack=4625 Win=1339 Len=0 TSval=7013 TSecr=3423968216
0.027292,1483,443,TCP,1483,36646  >  443 [ACK] Seq=128407 Ack=4625 Win=1339 Len=1368 TSval=7016 TSecr=3423968216 [TCP segment of a reassembled PDU]
0.000313,1483,443,TCP,1483,36646  >  443 [ACK] Seq=129775 Ack=4625 Win=1339 Len=1368 TSval=7016 TSecr=3423968216 [TCP segment of a reassembled PDU]
0.00023,262,443,TLSv1.2,262,Application Data
0.000273,1483,443,TCP,1483,36646  >  443 [ACK] Seq=131290 Ack=4625 Win=1339 Len=1368 TSval=7016 TSecr=3423968216 [TCP segment of a reassembled PDU]
0.00022,205,443,TLSv1.2,205,Application Data
0.000259,1483,443,TCP,1483,36646  >  443 [ACK] Seq=132748 Ack=4625 Win=1339 Len=1368 TSval=7016 TSecr=3423968216 [TCP segment of a reassembled PDU]
0.000272,1483,443,TCP,1483,36646  >  443 [ACK] Seq=134116 Ack=4625 Win=1339 Len=1368 TSval=7016 TSecr=3423968216 [TCP segment of a reassembled PDU]
0.000219,262,443,TLSv1.2,262,Application Data
0.000264,1483,443,TCP,1483,36646  >  443 [ACK] Seq=135631 Ack=4625 Win=1339 Len=1368 TSval=7016 TSecr=3423968216 [TCP segment of a reassembled PDU]
0.000432,1483,443,TCP,1483,[TCP Retransmission] 36646  >  443 [ACK] Seq=135631 Ack=4625 Win=1339 Len=1368 TSval=7016 TSecr=3423968216
0.000192,205,443,TLSv1.2,205,Application Data
0.030911,115,36646,TCP,115,443  >  36646 [ACK] Seq=4625 Ack=131143 Win=1050 Len=0 TSval=3423968278 TSecr=7016
0.000126,115,36646,TCP,115,[TCP Dup ACK 395#1] 443  >  36646 [ACK] Seq=4625 Ack=131143 Win=1050 Len=0 TSval=3423968278 TSecr=7016
0.000737,115,36646,TCP,115,[TCP Dup ACK 395#2] 443  >  36646 [ACK] Seq=4625 Ack=131143 Win=1050 Len=0 TSval=3423968278 TSecr=7016
0.000189,115,36646,TCP,115,443  >  36646 [ACK] Seq=4625 Ack=131290 Win=1050 Len=0 TSval=3423968278 TSecr=7016
0.000151,115,36646,TCP,115,443  >  36646 [ACK] Seq=4625 Ack=132748 Win=1048 Len=0 TSval=3423968279 TSecr=7016
0.000147,115,36646,TCP,115,443  >  36646 [ACK] Seq=4625 Ack=135484 Win=1050 Len=0 TSval=3423968280 TSecr=7016
0.000288,115,36646,TCP,115,443  >  36646 [ACK] Seq=4625 Ack=135631 Win=1050 Len=0 TSval=3423968280 TSecr=7016
0.000559,115,36646,TCP,115,443  >  36646 [ACK] Seq=4625 Ack=137089 Win=1048 Len=0 TSval=3423968281 TSecr=7016
0.086073,1401,443,TLSv1.2,1401,Application Data
0.033198,115,36646,TCP,115,443  >  36646 [ACK] Seq=4625 Ack=138375 Win=1050 Len=0 TSval=3423968400 TSecr=7028
0.110878,1483,443,TCP,1483,36646  >  443 [ACK] Seq=138375 Ack=4625 Win=1339 Len=1368 TSval=7042 TSecr=3423968400 [TCP segment of a reassembled PDU]
0.000791,1483,443,TCP,1483,[TCP Retransmission] 36646  >  443 [ACK] Seq=138375 Ack=4625 Win=1339 Len=1368 TSval=7042 TSecr=3423968400
0.00824,169,36646,TLSv1.2,169,Application Data
0.000872,1483,443,TCP,1483,[TCP Retransmission] 36646  >  443 [ACK] Seq=138375 Ack=4625 Win=1339 Len=1368 TSval=7042 TSecr=3423968400
0.000186,1483,443,TCP,1483,36646  >  443 [ACK] Seq=139743 Ack=4625 Win=1339 Len=1368 TSval=7042 TSecr=3423968400 [TCP segment of a reassembled PDU]
0.000366,262,443,TLSv1.2,262,Application Data
0.000236,1483,443,TCP,1483,36646  >  443 [ACK] Seq=141258 Ack=4625 Win=1339 Len=1368 TSval=7042 TSecr=3423968400 [TCP segment of a reassembled PDU]
0.000238,205,443,TLSv1.2,205,Application Data
0.032356,115,36646,TCP,115,443  >  36646 [ACK] Seq=4679 Ack=141111 Win=1050 Len=0 TSval=3423968554 TSecr=7042
0.000191,115,36646,TCP,115,443  >  36646 [ACK] Seq=4679 Ack=141258 Win=1050 Len=0 TSval=3423968554 TSecr=7042
0.000229,115,36646,TCP,115,443  >  36646 [ACK] Seq=4679 Ack=142716 Win=1048 Len=0 TSval=3423968555 TSecr=7042
0.000222,115,443,TCP,115,36646  >  443 [ACK] Seq=142716 Ack=4679 Win=1339 Len=0 TSval=7047 TSecr=3423968516
0.068924,1483,443,TCP,1483,36646  >  443 [ACK] Seq=142716 Ack=4679 Win=1339 Len=1368 TSval=7054 TSecr=3423968555 [TCP segment of a reassembled PDU]
0.000975,1483,443,TCP,1483,[TCP Retransmission] 36646  >  443 [ACK] Seq=142716 Ack=4679 Win=1339 Len=1368 TSval=7054 TSecr=3423968555
0.003708,1483,443,TCP,1483,[TCP Retransmission] 36646  >  443 [ACK] Seq=142716 Ack=4679 Win=1339 Len=1368 TSval=7054 TSecr=3423968555
0.000129,1483,443,TCP,1483,[TCP Retransmission] 36646  >  443 [ACK] Seq=142716 Ack=4679 Win=1339 Len=1368 TSval=7054 TSecr=3423968555
0.001459,1483,443,TCP,1483,[TCP Retransmission] 36646  >  443 [ACK] Seq=142716 Ack=4679 Win=1339 Len=1368 TSval=7054 TSecr=3423968555
0.023381,1483,443,TCP,1483,[TCP Retransmission] 36646  >  443 [ACK] Seq=142716 Ack=4679 Win=1339 Len=1368 TSval=7054 TSecr=3423968555
0.012983,1483,443,TCP,1483,36646  >  443 [ACK] Seq=144084 Ack=4679 Win=1339 Len=1368 TSval=7054 TSecr=3423968555 [TCP segment of a reassembled PDU]
0.000132,1483,443,TCP,1483,[TCP Retransmission] 36646  >  443 [ACK] Seq=144084 Ack=4679 Win=1339 Len=1368 TSval=7054 TSecr=3423968555
0.000187,262,443,TLSv1.2,262,Application Data
0.000334,1206,443,TLSv1.2,1206,Application Data
0.024097,115,36646,TCP,115,443  >  36646 [ACK] Seq=4679 Ack=144084 Win=1050 Len=0 TSval=3423968691 TSecr=7054
0.00942,115,36646,TCP,115,443  >  36646 [ACK] Seq=4679 Ack=146690 Win=1044 Len=0 TSval=3423968700 TSecr=7054
0.050094,206,36646,TLSv1.2,206,Application Data
0.000195,168,36646,TLSv1.2,168,Application Data
0.000276,115,443,TCP,115,36646  >  443 [ACK] Seq=146690 Ack=4770 Win=1339 Len=0 TSval=7066 TSecr=3423968750
0.000321,115,443,TCP,115,36646  >  443 [ACK] Seq=146690 Ack=4823 Win=1339 Len=0 TSval=7066 TSecr=3423968750
0.006634,204,36646,TLSv1.2,204,Application Data
0.000187,166,36646,TLSv1.2,166,Application Data
